{
  "id": "01ARZ3NDEKTSV4RRFFQ69G5FAV",
  "ts": "2025-08-24T16:42:00.000Z",
  "source": "zammad",
  "contact": {
    "id": "01ARZ3NDEKTSV4RRFFQ69G5FB1",
    "name": "John Doe",
    "email": "john.doe@example.com",
    "phone": "+14155551234",
    "language": "en-US",
    "timezone": "America/New_York",
    "created_at": "2025-08-24T16:42:00.000Z",
    "updated_at": "2025-08-24T16:42:00.000Z"
  },
  "status": "NEW",
  "priority": "P3",
  "correlation_id": "req_123456789",
  "tags": ["support", "billing"],
  "category": "billing",
  "payload": {
    "subject": "Billing inquiry",
    "description": "Question about monthly subscription charges"
  }
}